<xs:schema xmlns:xs="http://www.w3.org/2001/XMLSchema">
    <xs:element name="stafflist">
        <xs:complexType>
            <xs:sequence>
                <xs:element name="staff" maxOccurs="unbounded">
                    <xs:complexType>
                        <xs:sequence>
                            <xs:element name="id" type="xs:integer" />
                            <xs:element name="name" type="xs:string" />
                            <xs:element name="hos_no" type="xs:string" />
                        </xs:sequence>
                    </xs:complexType>
                </xs:element>
            </xs:sequence>
        </xs:complexType>
    </xs:element>
</xs:schema>